{
  "schema_version": "1.0",
  "company": {
    "name": "Antikor-Vitebsk",
    "website": "https://antikor-vitebsk.by/",
    "country": "BY",
    "locations": [
      {
        "city": "Витебск",
        "address": "Бешенковичское шоссе, 65 корпус 153 блок 5",
        "phones": [
          "+375 (29) 590-09-15"
        ],
        "working_hours": "Пн. - Вс. : 8:00 - 18:00"
      }
    ]
  },
  "source": {
    "scraped_at": "2026-10-26",
    "urls": [
      "https://antikor-vitebsk.by/"
    ],
    "notes": "Опубликованы только цены «от» для антикоррозийной обработки. Единица расчета отдельно не указана; цены VIP и дополнительных услуг отсутствуют. Диагностика днища заявлена бесплатной; цифровая цена не опубликована и не добавлена. Мобильная версия дополнительно перечисляет ремонт пластика, аргонодуговую сварку и установку фаркопов, кенгурятников. Гарантия заявлена без срока. Длительность работ в отзывах не используется как срок выполнения услуги. Информация на сайте носит ознакомительный характер и не является публичной офертой."
  },
  "currency": "BYN",
  "vehicle_types": [
    {
      "id": "vehicle-1",
      "name_original": "Седан",
      "class": "sedan"
    },
    {
      "id": "vehicle-2",
      "name_original": "Кроссовер",
      "class": "crossover"
    },
    {
      "id": "vehicle-3",
      "name_original": "Внедорожник",
      "class": "suv"
    }
  ],
  "services": [
    {
      "id": "anticorrosion",
      "service_key": "anticorrosion-full",
      "category": "anticorrosion",
      "name_original": "АНТИКОРРОЗИЙНАЯ ОБРАБОТКА",
      "description": "Этап 1 - Разборка автомобиля Снятие защит днища, выхлопной системы с подвесов, термозащитных экранов, защиты колесных арок, расширителей,пластиковых накладок на пороги и т.д. по согласованию с клиентом.\nЭтап 2 - Мойка автомобиля Тотальная мойка арок и днища автомобиля аппаратом высокого давление со специальным моющим средством. Мойка подкапотного пространства, петель, замков, проемов, завальцовок по согласованию с клиентом. Промывание водой под давлением порогов, лонжеронов, рамы от соли и песка.\nЭтап 3 - Сушка Принудительная сушка автомобиля горячим воздухом нагнетаемым под днище в тёплом, сухом помещении. Температура до 60 градусов.\nЭтап 4 - Оклейка Оклейка авто и элементов не подлежащих антикор обработке.\nЭтап 5 - Обработка Нанесение защитного состава на днище, арки и пороги. Большой выбор материалов для оптимальной защиты вашего автомобиля - Dinitrol 4941, Dinitrol Metalik, Wurt и др.\nЭтап 6 - Обработка скрытых полостей Обработка скрытых полостей консервантами Dinitrol ML, Dinitrol LT и др. Двери, капот, крышка багажника, пороги, лонжероны, различные нишы и отбортовки. Обработка петель, замков, резьбовых соединений, подкапотного пространства. Обработка прозрачным воском Dinitrol 81 завальцовок дверей, капота, крышки багажника. При необходимости - грунтование ингибитором коррозии ржавых участков перед нанесением защитного покрытия. Перечень вышеперечисленных работ согласовывается с клиентом.\nЭтап 7 - Финал Сушка. Расклейка, Сборка. Очистка кузова, подвески и агрегатов от излишков материала.",
      "url": "https://antikor-vitebsk.by/",
      "completion_time": null,
      "prices": [
        {
          "vehicle_type_id": "vehicle-1",
          "price": null,
          "price_min": 295,
          "price_max": null,
          "price_text_original": "от 295 Руб.",
          "notes": "Источник: https://antikor-vitebsk.by/; единица расчета отдельно не указана."
        },
        {
          "vehicle_type_id": "vehicle-2",
          "price": null,
          "price_min": 345,
          "price_max": null,
          "price_text_original": "от 345 Руб.",
          "notes": "Источник: https://antikor-vitebsk.by/; единица расчета отдельно не указана."
        },
        {
          "vehicle_type_id": "vehicle-3",
          "price": null,
          "price_min": 395,
          "price_max": null,
          "price_text_original": "от 395 Руб.",
          "notes": "Источник: https://antikor-vitebsk.by/; единица расчета отдельно не указана."
        }
      ]
    },
    {
      "id": "bodywork",
      "service_key": "body-painting",
      "category": "additional",
      "name_original": "КУЗОВНОЙ РЕМОНТ, ПОКРАСКА",
      "description": "Услуга перечислена на первом экране; цена не опубликована.",
      "url": "https://antikor-vitebsk.by/",
      "completion_time": null,
      "prices": []
    },
    {
      "id": "sandblasting",
      "service_key": "sandblasting",
      "category": "additional",
      "name_original": "ПЕСКОСТРУЙНАЯ ОБРАБОТКА",
      "description": "Услуга перечислена на первом экране; цена не опубликована.",
      "url": "https://antikor-vitebsk.by/",
      "completion_time": null,
      "prices": []
    },
    {
      "id": "exhaust-repair",
      "service_key": "antikor-vitebsk.by:exhaust-repair",
      "category": "additional",
      "name_original": "РЕМОНТ ГЛУШИТЕЛЕЙ",
      "description": "Услуга перечислена на первом экране; цена не опубликована.",
      "url": "https://antikor-vitebsk.by/",
      "completion_time": null,
      "prices": []
    },
    {
      "id": "plastic-repair",
      "service_key": "antikor-vitebsk.by:plastic-repair",
      "category": "additional",
      "name_original": "РЕМОНТ ПЛАСТИКА",
      "description": "Услуга перечислена на первом экране; цена не опубликована.",
      "url": "https://antikor-vitebsk.by/",
      "completion_time": null,
      "prices": []
    },
    {
      "id": "argon-welding",
      "service_key": "antikor-vitebsk.by:argon-welding",
      "category": "additional",
      "name_original": "АРГОНОДУГОВАЯ СВАРКА",
      "description": "Услуга перечислена на первом экране; цена не опубликована.",
      "url": "https://antikor-vitebsk.by/",
      "completion_time": null,
      "prices": []
    },
    {
      "id": "towbar-installation",
      "service_key": "antikor-vitebsk.by:towbar-installation",
      "category": "additional",
      "name_original": "УСТАНОВКА ФАРКОПОВ, КЕНГУРЯТНИКОВ",
      "description": "Услуга перечислена на первом экране; цена не опубликована.",
      "url": "https://antikor-vitebsk.by/",
      "completion_time": null,
      "prices": []
    },
    {
      "id": "vip",
      "service_key": "antikor-vitebsk.by:vip",
      "category": "anticorrosion",
      "name_original": "VIP",
      "description": "VIP (Реставрация покрытия днища, арок, ходовой части, антикор + влажная уборка салона и мойка кузова автомобиля) — Пескоструйная обработка арок, днища, рамы, мостов, подвески, тормозных суппортов, ступиц. — При необходимости производим сварочные работы. — Фосфатируем, цинкуем, грунтуем, окрашиваем отпескоструенный и вваренный металл: арки, днище, раму, подрамники, рычаги подвески, супорта, ступицы и т.д. — Выполняем чистку автомобиля после окончания работ. Пылесосим салон, проводим влажную уборку с приминением моющих средств, обрабатываем полиролем пластиковые элементы. Проводим чернение резины и натирку стекол",
      "url": "https://antikor-vitebsk.by/",
      "completion_time": null,
      "prices": []
    },
    {
      "id": "wheel-painting",
      "service_key": "antikor-vitebsk.by:wheel-painting",
      "category": "additional",
      "name_original": "ПОЛИМЕРНАЯ ПОКРАСКА ДИСКОВ",
      "description": "Пока машина на Антикоррозийной обработке, мы также можем обновить и исправить внешний вид дисков. Покраска дисков порошковой краской — это отличный внешний вид вашего автомобиля и разумная экономия! Покраска полимерным порошком создает прочное покрытие, защищающее от ржавчины, истирания, воздействия химических средств, бензина и сильных перепадов температур. Окрашенный диск становится устойчивым к механическим нагрузкам. Такая защита значительно продлевает срок службы. Обязательная пескоструйная обработка перед окраской шлифует поверхность и выравнивает небольшие царапины. «Убитым», поцарапанным, отколотым или мятым со следами коррозии колесам окрашивание быстро вернет заводской вид. Кроме того, предоставляем услуги шиномонтажа, сварки и выравнивания дисков.",
      "url": "https://antikor-vitebsk.by/",
      "completion_time": null,
      "prices": []
    },
    {
      "id": "wheel-repair-and-tyres",
      "service_key": "antikor-vitebsk.by:wheel-repair-and-tyres",
      "category": "additional",
      "name_original": "услуги шиномонтажа, сварки и выравнивания дисков",
      "description": "Пока машина на Антикоррозийной обработке, мы также можем обновить и исправить внешний вид дисков. Покраска дисков порошковой краской — это отличный внешний вид вашего автомобиля и разумная экономия! Покраска полимерным порошком создает прочное покрытие, защищающее от ржавчины, истирания, воздействия химических средств, бензина и сильных перепадов температур. Окрашенный диск становится устойчивым к механическим нагрузкам. Такая защита значительно продлевает срок службы. Обязательная пескоструйная обработка перед окраской шлифует поверхность и выравнивает небольшие царапины. «Убитым», поцарапанным, отколотым или мятым со следами коррозии колесам окрашивание быстро вернет заводской вид. Кроме того, предоставляем услуги шиномонтажа, сварки и выравнивания дисков.",
      "url": "https://antikor-vitebsk.by/",
      "completion_time": null,
      "prices": []
    },
    {
      "id": "underbody-inspection",
      "service_key": "inspection",
      "category": "additional",
      "name_original": "диагностику днища вашего авто",
      "description": "Сотрудники компании с радостью ответят на все ваши вопросы, а в нашем центре мы сделаем диагностику днища вашего авто совершенно бесплатно.",
      "url": "https://antikor-vitebsk.by/",
      "completion_time": null,
      "prices": []
    }
  ]
}
