{
  "schema_version": "1.0",
  "company": {
    "name": "ИП Бунжа О.Я.",
    "website": "https://anticorlida.by/",
    "country": "BY",
    "locations": [
      {
        "city": "Лида",
        "address": "ул. Адама Мицкевича, 41, корпус 2, Лида",
        "phones": [
          "+375 29 677 50 00"
        ]
      }
    ]
  },
  "source": {
    "scraped_at": "2026-10-26",
    "urls": [
      "https://anticorlida.by/"
    ],
    "notes": "На сайте нет числового прайса: стоимость комплексной обработки не опубликована; prices: []. Экспертиза обозначена «бесплатно»; исходный текст сохранён без выдуманной числовой цены. Категории автомобилей, единицы тарификации и срок выполнения не указаны. BYN — техническая валюта сравнения для Беларуси; на странице валюта не указана. Марки антикоррозийных материалов, срок гарантии и точный график работы не указаны. DETAIL — оборудование для сушки."
  },
  "currency": "BYN",
  "vehicle_types": [],
  "services": [
    {
      "id": "comprehensive-protection",
      "service_key": "anticorrosion-full",
      "category": "anticorrosion",
      "name_original": "Комплексная защита автомобиля от коррозии",
      "description": "Моторный отсек.\nВнутренние полости дверей, капота, крышки багажника.\nДнище, лонжероны, пороги, рама автомобиля, топливопроводы, тормозные трубки. Антикоррозийное покрытие на днище, лонжеронах, порогах, раме автомобиля, топливопроводах, тормозных трубках\nКолёсные арки\nДетали подвески",
      "url": "https://anticorlida.by/",
      "completion_time": null,
      "prices": []
    },
    {
      "id": "anticorrosion-inspection",
      "service_key": "inspection",
      "category": "additional",
      "name_original": "Антикоррозийная экспертиза вашего автомобиля бесплатно",
      "description": "Позвоните нам и мы запишем Вас на экспертизу в удобное время",
      "url": "https://anticorlida.by/",
      "completion_time": null,
      "prices": []
    }
  ]
}
